{
  "schema_version": "1.0.0",
  "content_id": "FL-TEST-C",
  "article_version": "article-1.0.0",
  "source_article_reference": "docs/editorial/test-articles/FL-TEST-C/article.md",
  "source_blueprint_reference": "docs/editorial/test-articles/FL-TEST-C/blueprint.json",
  "draft_sha256": "d0a261c9e017b572f1d43b6cb7f8e068a45fcb7d8ab8353243843b8d5e4349e0",
  "blueprint_sha256": "8a82b48f67035784ab55e9f89fea2228b66c21ba05ade7ef847a28c6fd0da066",
  "visual_style_version": "visual-style-0.1.0",
  "visual_identity_sha256": "f405edfbc5b82f3a9022540a04d473829bb5327ca5f83b5e92848252724dcb59",
  "featured_exception_reason": null,
  "images": [
    {
      "image_id": "FL-TEST-C-featured",
      "content_id": "FL-TEST-C",
      "image_role": "featured",
      "visual_type": "ILLUSTRATION",
      "section_id": "featured",
      "section_heading": null,
      "purpose": "個人条件を継続して記入し見直すPREMIUM候補の用途を伝え、成功のグラフや成果写真を作らない",
      "visual_subject": "開いた白紙のワークブックと三枚の記入用紙を並べ、条件・試行・比較を記録する机上のイメージ",
      "composition": "余白を残した横長16:9の俯瞰寄りの静物構図",
      "environment": "実在場所を特定しない、落ち着いた日本の住まいを想起する机上",
      "lighting": "やわらかな自然光",
      "mood": "clean / premium / editorial / Japanese / calm",
      "aspect_ratio": "16:9",
      "recommended_width": 1536,
      "recommended_height": 864,
      "alt": "白紙のワークブックと付箋付きの三枚の用紙、鉛筆を並べたAI生成イメージ",
      "alt_text": "白紙のワークブックと付箋付きの三枚の用紙、鉛筆を並べたAI生成イメージ",
      "caption": "AI生成のイメージ画像です。実在する場所や体験の写真ではありません。",
      "generation_prompt": "Fortune Labo visual-style-0.1.0. Clean, premium Japanese editorial illustration with delicate watercolor and fine pencil edges, restrained texture, warm ivory paper, muted sage gray and natural wood, charcoal small details. Quiet natural window light, soft realistic shadows, calm and dignified. Landscape 16:9, editorial featured image, recommended 1536x864. No text, no letters, no numbers, no symbols resembling writing, no watermark, no logo, no people. Avoid star fields, outer space, strong glow, excess gold, crystal balls, purple dominance. This is an illustrative still life, not documentary photography of a real place. Article source FL-TEST-C: a self-filled 90-day career workbook for recording conditions, trying one action, and comparing options with unknowns preserved. Show an open blank workbook and three orderly blank loose sheets with subtle unprinted paper tabs, arranged in a quiet left-to-right sequence on a natural wood desk. A single modest pencil connects the visual language to deliberate note-taking. Suggest repeated reflection rather than guaranteed progress. No numbers, no calendars with writing, no chart claiming success, no graduation or achievement symbols. Wide elevated composition, calm natural light.",
      "negative_requirements": [
        "no_long_japanese_text_in_raster",
        "no_fabricated_firsthand_evidence",
        "no_cosmic_or_occult_cliches"
      ],
      "required": true,
      "placement": "featured",
      "render_method": "raster",
      "text_policy": "none",
      "text_labels": [],
      "no_image_reason": null,
      "generation_status": "generated",
      "generation_error": null,
      "generated_asset_reference": {
        "asset_id": "FL-TEST-C-featured-asset-01",
        "relative_path": "images/featured-v1.png",
        "image_sha256": "c9ef8c812329b3731e85ec174fdc92bdcc62464e8487904b8c1f2c181c1e6e23",
        "mime_type": "image/png",
        "width": 1672,
        "height": 941,
        "state": "generated",
        "provenance": {
          "origin": "generated",
          "source_reference": "docs/editorial/creative-fixtures/FL-TEST-C/image-plan.json#FL-TEST-C-featured",
          "generator": "built_in_image_gen",
          "created_at": "2026-10-07T08:50:30.831946+00:00",
          "license_status": "generated_original",
          "rights_reference": null,
          "human_capture_confirmed": false
        },
        "source_asset_reference": null
      },
      "factual_subject_kind": "none",
      "factual_reference_required": false,
      "factual_source_reference": null,
      "requires_actual_photo": false,
      "illustrative_disclosure": "AI生成のイメージ画像です。実在する場所や体験の写真ではありません。"
    },
    {
      "image_id": "FL-TEST-C-h2-01",
      "content_id": "FL-TEST-C",
      "image_role": "section",
      "visual_type": "NO_IMAGE",
      "section_id": "h2-01",
      "section_heading": "最初に、守りたい条件と計画の上限を決める",
      "purpose": "既存の条件シートが視覚的な記入枠を提供するため、同内容の画像は不要。",
      "visual_subject": null,
      "composition": null,
      "environment": null,
      "lighting": null,
      "mood": null,
      "aspect_ratio": null,
      "recommended_width": null,
      "recommended_height": null,
      "alt": null,
      "alt_text": null,
      "caption": null,
      "generation_prompt": null,
      "negative_requirements": [],
      "required": false,
      "placement": "none",
      "render_method": "none",
      "text_policy": "none",
      "text_labels": [],
      "no_image_reason": "既存の条件シートが視覚的な記入枠を提供するため、同内容の画像は不要。",
      "generation_status": "not_applicable",
      "generation_error": null,
      "generated_asset_reference": null,
      "factual_subject_kind": "none",
      "factual_reference_required": false,
      "factual_source_reference": null,
      "requires_actual_photo": false,
      "illustrative_disclosure": null
    },
    {
      "image_id": "FL-TEST-C-h2-02",
      "content_id": "FL-TEST-C",
      "image_role": "section",
      "visual_type": "NO_IMAGE",
      "section_id": "h2-02",
      "section_heading": "1〜30日：経験を、確かめられる問いにする",
      "purpose": "経験を具体的な問いへ変える段落説明を優先し、同じ内容の工程図を重ねない。",
      "visual_subject": null,
      "composition": null,
      "environment": null,
      "lighting": null,
      "mood": null,
      "aspect_ratio": null,
      "recommended_width": null,
      "recommended_height": null,
      "alt": null,
      "alt_text": null,
      "caption": null,
      "generation_prompt": null,
      "negative_requirements": [],
      "required": false,
      "placement": "none",
      "render_method": "none",
      "text_policy": "none",
      "text_labels": [],
      "no_image_reason": "経験を具体的な問いへ変える段落説明を優先し、同じ内容の工程図を重ねない。",
      "generation_status": "not_applicable",
      "generation_error": null,
      "generated_asset_reference": null,
      "factual_subject_kind": "none",
      "factual_reference_required": false,
      "factual_source_reference": null,
      "requires_actual_photo": false,
      "illustrative_disclosure": null
    },
    {
      "image_id": "FL-TEST-C-h2-03",
      "content_id": "FL-TEST-C",
      "image_role": "section",
      "visual_type": "NO_IMAGE",
      "section_id": "h2-03",
      "section_heading": "31〜60日：一つ試して、結果の読み方を決める",
      "purpose": "既存の試行メモ表を編集可能なテキストとして使うため、画像化しない。",
      "visual_subject": null,
      "composition": null,
      "environment": null,
      "lighting": null,
      "mood": null,
      "aspect_ratio": null,
      "recommended_width": null,
      "recommended_height": null,
      "alt": null,
      "alt_text": null,
      "caption": null,
      "generation_prompt": null,
      "negative_requirements": [],
      "required": false,
      "placement": "none",
      "render_method": "none",
      "text_policy": "none",
      "text_labels": [],
      "no_image_reason": "既存の試行メモ表を編集可能なテキストとして使うため、画像化しない。",
      "generation_status": "not_applicable",
      "generation_error": null,
      "generated_asset_reference": null,
      "factual_subject_kind": "none",
      "factual_reference_required": false,
      "factual_source_reference": null,
      "requires_actual_photo": false,
      "illustrative_disclosure": null
    },
    {
      "image_id": "FL-TEST-C-h2-04",
      "content_id": "FL-TEST-C",
      "image_role": "section",
      "visual_type": "NO_IMAGE",
      "section_id": "h2-04",
      "section_heading": "61〜90日：比較表から次の期間を選ぶ",
      "purpose": "既存の比較表で未確認項目を残せるため、装飾的なグラフや成果イメージを追加しない。",
      "visual_subject": null,
      "composition": null,
      "environment": null,
      "lighting": null,
      "mood": null,
      "aspect_ratio": null,
      "recommended_width": null,
      "recommended_height": null,
      "alt": null,
      "alt_text": null,
      "caption": null,
      "generation_prompt": null,
      "negative_requirements": [],
      "required": false,
      "placement": "none",
      "render_method": "none",
      "text_policy": "none",
      "text_labels": [],
      "no_image_reason": "既存の比較表で未確認項目を残せるため、装飾的なグラフや成果イメージを追加しない。",
      "generation_status": "not_applicable",
      "generation_error": null,
      "generated_asset_reference": null,
      "factual_subject_kind": "none",
      "factual_reference_required": false,
      "factual_source_reference": null,
      "requires_actual_photo": false,
      "illustrative_disclosure": null
    }
  ],
  "status": "assets_ready_for_qa",
  "human_approval": null,
  "publication_allowed": false
}
