{
  "schema_version": "1.0.0",
  "content_id": "FL-TEST-B",
  "article_version": "article-1.0.0",
  "source_article_reference": "docs/editorial/test-articles/FL-TEST-B/article.md",
  "source_blueprint_reference": "docs/editorial/test-articles/FL-TEST-B/blueprint.json",
  "draft_sha256": "d347a2a01d0210b44b7078946fb17a8dceb70180562b9a97f069c2cf3d506830",
  "blueprint_sha256": "9ffc2e82e194131ff4295e66c1be99f2db9bd8c13e5ccb7fa5decfce4607aa85",
  "visual_style_version": "visual-style-0.1.0",
  "visual_identity_sha256": "f405edfbc5b82f3a9022540a04d473829bb5327ca5f83b5e92848252724dcb59",
  "featured_exception_reason": null,
  "images": [
    {
      "image_id": "FL-TEST-B-featured",
      "content_id": "FL-TEST-B",
      "image_role": "featured",
      "visual_type": "ILLUSTRATION",
      "section_id": "featured",
      "section_heading": null,
      "purpose": "相手の気持ちを当てるのでなく自分の予定を選ぶ、という本文の態度を示す",
      "visual_subject": "伏せたスマートフォンを脇に置き、ノートとカップのある窓辺で自分の時間を過ごすイメージ",
      "composition": "余白を残した横長16:9の俯瞰寄りの静物構図",
      "environment": "実在場所を特定しない、落ち着いた日本の住まいを想起する机上",
      "lighting": "やわらかな自然光",
      "mood": "clean / premium / editorial / Japanese / calm",
      "aspect_ratio": "16:9",
      "recommended_width": 1536,
      "recommended_height": 864,
      "alt": "伏せたスマートフォン、閉じたノート、カップを自然光の机に置いたAI生成イメージ",
      "alt_text": "伏せたスマートフォン、閉じたノート、カップを自然光の机に置いたAI生成イメージ",
      "caption": "AI生成のイメージ画像です。実在する場所や体験の写真ではありません。",
      "generation_prompt": "Fortune Labo visual-style-0.1.0. Clean, premium Japanese editorial illustration with delicate watercolor and fine pencil edges, restrained texture, warm ivory paper, muted sage gray and natural wood, charcoal small details. Quiet natural window light, soft realistic shadows, calm and dignified. Landscape 16:9, editorial featured image, recommended 1536x864. No text, no letters, no numbers, no symbols resembling writing, no watermark, no logo, no people. Avoid star fields, outer space, strong glow, excess gold, crystal balls, purple dominance. This is an illustrative still life, not documentary photography of a real place. Article source FL-TEST-B: waiting for a reply, distinguish confirmed events from imagined meanings, respect the other person's request, and choose one's own plans while waiting. Show a face-down unbranded smartphone resting off to the side of a closed blank notebook, a small plain ceramic cup and a softly lit window-side table. The phone is secondary; the notebook and ordinary quiet time are the focus. No notification badges, chat bubbles, hearts, romantic couples, screens, or implied knowledge of another person's feelings. Balanced still-life scene with natural window light.",
      "negative_requirements": [
        "no_long_japanese_text_in_raster",
        "no_fabricated_firsthand_evidence",
        "no_cosmic_or_occult_cliches"
      ],
      "required": true,
      "placement": "featured",
      "render_method": "raster",
      "text_policy": "none",
      "text_labels": [],
      "no_image_reason": null,
      "generation_status": "generated",
      "generation_error": null,
      "generated_asset_reference": {
        "asset_id": "FL-TEST-B-featured-asset-01",
        "relative_path": "images/featured-v1.png",
        "image_sha256": "6a543c6ad23cb389a053abb252cd41401fcbb92d76bb88313762d489640c6ae6",
        "mime_type": "image/png",
        "width": 1672,
        "height": 941,
        "state": "generated",
        "provenance": {
          "origin": "generated",
          "source_reference": "docs/editorial/creative-fixtures/FL-TEST-B/image-plan.json#FL-TEST-B-featured",
          "generator": "built_in_image_gen",
          "created_at": "2026-10-07T08:50:30.827651+00:00",
          "license_status": "generated_original",
          "rights_reference": null,
          "human_capture_confirmed": false
        },
        "source_asset_reference": null
      },
      "factual_subject_kind": "none",
      "factual_reference_required": false,
      "factual_source_reference": null,
      "requires_actual_photo": false,
      "illustrative_disclosure": "AI生成のイメージ画像です。実在する場所や体験の写真ではありません。"
    },
    {
      "image_id": "FL-TEST-B-section-01",
      "content_id": "FL-TEST-B",
      "image_role": "diagram",
      "visual_type": "DIAGRAM",
      "section_id": "h2-01",
      "section_heading": "事実と想像を別の欄に置く",
      "purpose": "本文の分類を一目で比較できる補助図。例は本文の架空場面に限定する。",
      "visual_subject": "確認できていること / まだ分からないこと",
      "composition": "等間隔の比較カードと短い見出し",
      "environment": "余白のある白い編集面",
      "lighting": "影のない平面レイアウト",
      "mood": "clean / premium / editorial / Japanese / calm",
      "aspect_ratio": "60:23",
      "recommended_width": 1200,
      "recommended_height": 460,
      "alt": "返信待ちで、送った用件・日時と、まだ分からない相手の事情・気持ちを別々に置く整理図",
      "alt_text": "返信待ちで、送った用件・日時と、まだ分からない相手の事情・気持ちを別々に置く整理図",
      "caption": "整理用の図です。相手の気持ちを判定するものではありません。",
      "generation_prompt": "AIによる文字描画は使わない。元SVGのnative text層に次の短いラベルを置き、本文の分類を崩さずPNGへレンダリングする: 確認できていること / まだ分からないこと",
      "negative_requirements": [
        "no_long_japanese_text_in_raster",
        "no_fabricated_firsthand_evidence",
        "no_cosmic_or_occult_cliches"
      ],
      "required": true,
      "placement": "after_h2",
      "render_method": "native_svg_render",
      "text_policy": "native_text_layer",
      "text_labels": [
        "確認できていること",
        "まだ分からないこと"
      ],
      "no_image_reason": null,
      "generation_status": "supplied",
      "generation_error": null,
      "generated_asset_reference": {
        "asset_id": "FL-TEST-B-section-01-asset-01",
        "relative_path": "images/section-01.png",
        "image_sha256": "9bf54a971a8e94d0afad7b1be3f6d618bce369fce23b966e654b05b7eefdf094",
        "mime_type": "image/png",
        "width": 1200,
        "height": 460,
        "state": "supplied",
        "provenance": {
          "origin": "native_vector",
          "source_reference": "images/section-01.svg",
          "generator": "native_svg_renderer",
          "created_at": "2026-10-07T08:53:52.645570+00:00",
          "license_status": "original_code",
          "rights_reference": null,
          "human_capture_confirmed": false
        },
        "source_asset_reference": {
          "relative_path": "images/section-01.svg",
          "image_sha256": "a4e572da0506fce11e33b950a600b17aee09231218e9cebd088d1334d7909eaf",
          "mime_type": "image/svg+xml",
          "width": 1200,
          "height": 460
        }
      },
      "factual_subject_kind": "none",
      "factual_reference_required": false,
      "factual_source_reference": null,
      "requires_actual_photo": false,
      "illustrative_disclosure": null
    },
    {
      "image_id": "FL-TEST-B-h2-02",
      "content_id": "FL-TEST-B",
      "image_role": "section",
      "visual_type": "NO_IMAGE",
      "section_id": "h2-02",
      "section_heading": "送る前に用件と相手の希望を確認する",
      "purpose": "仮の連絡文は選択・コピーできる本文テキストに残し、画像化による誤読を避ける。",
      "visual_subject": null,
      "composition": null,
      "environment": null,
      "lighting": null,
      "mood": null,
      "aspect_ratio": null,
      "recommended_width": null,
      "recommended_height": null,
      "alt": null,
      "alt_text": null,
      "caption": null,
      "generation_prompt": null,
      "negative_requirements": [],
      "required": false,
      "placement": "none",
      "render_method": "none",
      "text_policy": "none",
      "text_labels": [],
      "no_image_reason": "仮の連絡文は選択・コピーできる本文テキストに残し、画像化による誤読を避ける。",
      "generation_status": "not_applicable",
      "generation_error": null,
      "generated_asset_reference": null,
      "factual_subject_kind": "none",
      "factual_reference_required": false,
      "factual_source_reference": null,
      "requires_actual_photo": false,
      "illustrative_disclosure": null
    },
    {
      "image_id": "FL-TEST-B-h2-03",
      "content_id": "FL-TEST-B",
      "image_role": "section",
      "visual_type": "NO_IMAGE",
      "section_id": "h2-03",
      "section_heading": "待つ間の予定は、自分で決めてよい",
      "purpose": "Featured Imageで静かな生活の場面を示しているため、同じ雰囲気の写真を重ねない。",
      "visual_subject": null,
      "composition": null,
      "environment": null,
      "lighting": null,
      "mood": null,
      "aspect_ratio": null,
      "recommended_width": null,
      "recommended_height": null,
      "alt": null,
      "alt_text": null,
      "caption": null,
      "generation_prompt": null,
      "negative_requirements": [],
      "required": false,
      "placement": "none",
      "render_method": "none",
      "text_policy": "none",
      "text_labels": [],
      "no_image_reason": "Featured Imageで静かな生活の場面を示しているため、同じ雰囲気の写真を重ねない。",
      "generation_status": "not_applicable",
      "generation_error": null,
      "generated_asset_reference": null,
      "factual_subject_kind": "none",
      "factual_reference_required": false,
      "factual_source_reference": null,
      "requires_actual_photo": false,
      "illustrative_disclosure": null
    }
  ],
  "status": "assets_ready_for_qa",
  "human_approval": null,
  "publication_allowed": false
}
