{
  "schema_version": "1.0.0",
  "content_id": "FL-TEST-A",
  "article_version": "article-1.0.0",
  "source_article_reference": "docs/editorial/test-articles/FL-TEST-A/article.md",
  "source_blueprint_reference": "docs/editorial/test-articles/FL-TEST-A/blueprint.json",
  "draft_sha256": "adcb4e41b30cb9fcacf63666e957443e32656c27ff5fcdb96ec7b863450c15be",
  "blueprint_sha256": "46e54b9f8b74d977a912e246666dbf86ebe75d89537fb7eb74191d8600dd36ae",
  "visual_style_version": "visual-style-0.1.0",
  "visual_identity_sha256": "f405edfbc5b82f3a9022540a04d473829bb5327ca5f83b5e92848252724dcb59",
  "featured_exception_reason": null,
  "images": [
    {
      "image_id": "FL-TEST-A-featured",
      "content_id": "FL-TEST-A",
      "image_role": "featured",
      "visual_type": "ILLUSTRATION",
      "section_id": "featured",
      "section_heading": null,
      "purpose": "応募を急がず条件を整理するという本文の入り口を、静かな机上のイメージで伝える",
      "visual_subject": "白紙のノートと三つのカードで、仕事の条件を整理する机上の場面",
      "composition": "余白を残した横長16:9の俯瞰寄りの静物構図",
      "environment": "実在場所を特定しない、落ち着いた日本の住まいを想起する机上",
      "lighting": "やわらかな自然光",
      "mood": "clean / premium / editorial / Japanese / calm",
      "aspect_ratio": "16:9",
      "recommended_width": 1536,
      "recommended_height": 864,
      "alt": "自然光の入る机に開いた白紙のノート、三枚のカード、鉛筆を置いたAI生成イメージ",
      "alt_text": "自然光の入る机に開いた白紙のノート、三枚のカード、鉛筆を置いたAI生成イメージ",
      "caption": "AI生成のイメージ画像です。実在する場所や体験の写真ではありません。",
      "generation_prompt": "Fortune Labo visual-style-0.1.0. Clean, premium Japanese editorial illustration with delicate watercolor and fine pencil edges, restrained texture, warm ivory paper, muted sage gray and natural wood, charcoal small details. Quiet natural window light, soft realistic shadows, calm and dignified. Landscape 16:9, editorial featured image, recommended 1536x864. No text, no letters, no numbers, no symbols resembling writing, no watermark, no logo, no people. Avoid star fields, outer space, strong glow, excess gold, crystal balls, purple dominance. This is an illustrative still life, not documentary photography of a real place. Article source FL-TEST-A: a reader wants to change jobs but cannot start. The article asks them to separate what they want to change, what they want to keep, and what is still unknown, then verify one condition without rushing into resignation. Show a thoughtfully arranged quiet Japanese home desk with exactly three distinct blank paper cards and a modest charcoal pencil beside an open blank notebook. The cards form three separated groups suggesting sorting working conditions, without icons or labels. A gentle visual sense of a manageable first step, no career success trope, no office skyline. Balanced elevated three-quarter composition, room to breathe.",
      "negative_requirements": [
        "no_long_japanese_text_in_raster",
        "no_fabricated_firsthand_evidence",
        "no_cosmic_or_occult_cliches"
      ],
      "required": true,
      "placement": "featured",
      "render_method": "raster",
      "text_policy": "none",
      "text_labels": [],
      "no_image_reason": null,
      "generation_status": "generated",
      "generation_error": null,
      "generated_asset_reference": {
        "asset_id": "FL-TEST-A-featured-asset-01",
        "relative_path": "images/featured-v1.png",
        "image_sha256": "a912014f28e8af518f317f609be5d60116785f85deaee31f46b125c545d30058",
        "mime_type": "image/png",
        "width": 1672,
        "height": 941,
        "state": "generated",
        "provenance": {
          "origin": "generated",
          "source_reference": "docs/editorial/creative-fixtures/FL-TEST-A/image-plan.json#FL-TEST-A-featured",
          "generator": "built_in_image_gen",
          "created_at": "2026-10-07T08:50:30.822538+00:00",
          "license_status": "generated_original",
          "rights_reference": null,
          "human_capture_confirmed": false
        },
        "source_asset_reference": null
      },
      "factual_subject_kind": "none",
      "factual_reference_required": false,
      "factual_source_reference": null,
      "requires_actual_photo": false,
      "illustrative_disclosure": "AI生成のイメージ画像です。実在する場所や体験の写真ではありません。"
    },
    {
      "image_id": "FL-TEST-A-section-01",
      "content_id": "FL-TEST-A",
      "image_role": "explanation",
      "visual_type": "INFOGRAPHIC",
      "section_id": "h2-01",
      "section_heading": "困った場面から、変えたい条件を取り出す",
      "purpose": "本文の分類を一目で比較できる補助図。例は本文の架空場面に限定する。",
      "visual_subject": "変えたいこと / 残したいこと / 未確認のこと",
      "composition": "等間隔の比較カードと短い見出し",
      "environment": "余白のある白い編集面",
      "lighting": "影のない平面レイアウト",
      "mood": "clean / premium / editorial / Japanese / calm",
      "aspect_ratio": "60:23",
      "recommended_width": 1200,
      "recommended_height": 460,
      "alt": "仕事の条件を、変えたいこと・残したいこと・未確認のことに分ける整理図",
      "alt_text": "仕事の条件を、変えたいこと・残したいこと・未確認のことに分ける整理図",
      "caption": "本文の整理手順を示す説明図です。記入例は架空の例です。",
      "generation_prompt": "AIによる文字描画は使わない。元SVGのnative text層に次の短いラベルを置き、本文の分類を崩さずPNGへレンダリングする: 変えたいこと / 残したいこと / 未確認のこと",
      "negative_requirements": [
        "no_long_japanese_text_in_raster",
        "no_fabricated_firsthand_evidence",
        "no_cosmic_or_occult_cliches"
      ],
      "required": true,
      "placement": "after_h2",
      "render_method": "native_svg_render",
      "text_policy": "native_text_layer",
      "text_labels": [
        "変えたいこと",
        "残したいこと",
        "未確認のこと"
      ],
      "no_image_reason": null,
      "generation_status": "supplied",
      "generation_error": null,
      "generated_asset_reference": {
        "asset_id": "FL-TEST-A-section-01-asset-01",
        "relative_path": "images/section-01.png",
        "image_sha256": "14f1d8c0e9dcf1a963d13711b3da231931e2ae9b4f2c34be78926f815b103517",
        "mime_type": "image/png",
        "width": 1200,
        "height": 460,
        "state": "supplied",
        "provenance": {
          "origin": "native_vector",
          "source_reference": "images/section-01.svg",
          "generator": "native_svg_renderer",
          "created_at": "2026-10-07T08:53:52.629888+00:00",
          "license_status": "original_code",
          "rights_reference": null,
          "human_capture_confirmed": false
        },
        "source_asset_reference": {
          "relative_path": "images/section-01.svg",
          "image_sha256": "151327ef99749e1c0fa0afd6d131d975cbb788fea5a32c12f90c9ce824b1185b",
          "mime_type": "image/svg+xml",
          "width": 1200,
          "height": 460
        }
      },
      "factual_subject_kind": "none",
      "factual_reference_required": false,
      "factual_source_reference": null,
      "requires_actual_photo": false,
      "illustrative_disclosure": null
    },
    {
      "image_id": "FL-TEST-A-h2-02",
      "content_id": "FL-TEST-A",
      "image_role": "section",
      "visual_type": "NO_IMAGE",
      "section_id": "h2-02",
      "section_heading": "分からないことを一つだけ確かめる",
      "purpose": "本文にある確認質問を画像で重複させず、読みながら自分の問いを書ける構成を優先する。",
      "visual_subject": null,
      "composition": null,
      "environment": null,
      "lighting": null,
      "mood": null,
      "aspect_ratio": null,
      "recommended_width": null,
      "recommended_height": null,
      "alt": null,
      "alt_text": null,
      "caption": null,
      "generation_prompt": null,
      "negative_requirements": [],
      "required": false,
      "placement": "none",
      "render_method": "none",
      "text_policy": "none",
      "text_labels": [],
      "no_image_reason": "本文にある確認質問を画像で重複させず、読みながら自分の問いを書ける構成を優先する。",
      "generation_status": "not_applicable",
      "generation_error": null,
      "generated_asset_reference": null,
      "factual_subject_kind": "none",
      "factual_reference_required": false,
      "factual_source_reference": null,
      "requires_actual_photo": false,
      "illustrative_disclosure": null
    },
    {
      "image_id": "FL-TEST-A-h2-03",
      "content_id": "FL-TEST-A",
      "image_role": "section",
      "visual_type": "NO_IMAGE",
      "section_id": "h2-03",
      "section_heading": "次の判断をするためのメモを残す",
      "purpose": "短いメモ例と任意CTAで十分に手順が伝わるため、追加の装飾画像を置かない。",
      "visual_subject": null,
      "composition": null,
      "environment": null,
      "lighting": null,
      "mood": null,
      "aspect_ratio": null,
      "recommended_width": null,
      "recommended_height": null,
      "alt": null,
      "alt_text": null,
      "caption": null,
      "generation_prompt": null,
      "negative_requirements": [],
      "required": false,
      "placement": "none",
      "render_method": "none",
      "text_policy": "none",
      "text_labels": [],
      "no_image_reason": "短いメモ例と任意CTAで十分に手順が伝わるため、追加の装飾画像を置かない。",
      "generation_status": "not_applicable",
      "generation_error": null,
      "generated_asset_reference": null,
      "factual_subject_kind": "none",
      "factual_reference_required": false,
      "factual_source_reference": null,
      "requires_actual_photo": false,
      "illustrative_disclosure": null
    }
  ],
  "status": "assets_ready_for_qa",
  "human_approval": null,
  "publication_allowed": false
}
